{
 "slug": "sauna--kusatsu",
 "condition": {
  "slug": "sauna",
  "label": "サウナ"
 },
 "area": {
  "slug": "kusatsu",
  "label": "草津",
  "officialName": "草津温泉・白根"
 },
 "dataAsOf": "2026-10-22",
 "detection": {
  "type": "facility"
 },
 "stats": {
  "matchCount": 13,
  "matchRate": 14.4,
  "denominator": {
   "type": "listed_top",
   "value": 90,
   "label": "当サイト掲載施設(人気上位)数"
  },
  "minPrice": 8998,
  "medianPrice": 15400,
  "reviewAvgMean": 4.39,
  "pricedCount": 13
 },
 "hotels": [
  {
   "hotelNo": 143278,
   "name": "草津温泉　ホテルクアビオ（Ｈｏｔｅｌ　ＫＵＲＢＩＯ）",
   "kana": "ほてるくあびお",
   "minCharge": 24150,
   "reviewAverage": 4.79,
   "reviewCount": 105,
   "access": "ＪＲ長野原草津口駅よりバス草津バスターミナル行きにて２５分草津バスターミナル下車徒歩にて１３分、お車にて５分（送迎あり）",
   "address1": "群馬県",
   "address2": "吾妻郡草津町草津226-63",
   "infoUrl": "https://hb.afl.rakuten.co.jp/hgc/1b181ff9.a7b47385.1b181ffa.294cb7e7/?pc=https%3A%2F%2Fimg.travel.rakuten.co.jp%2Fimage%2Ftr%2Fapi%2Fhs%2FdQ4dX%2F%3Ff_no%3D143278",
   "planUrl": "https://hb.afl.rakuten.co.jp/hgc/1b181ff9.a7b47385.1b181ffa.294cb7e7/?pc=https%3A%2F%2Fimg.travel.rakuten.co.jp%2Fimage%2Ftr%2Fapi%2Fhs%2FcHNRi%2F%3Ff_no%3D143278%26f_flg%3DPLAN",
   "reviewUrl": "https://hb.afl.rakuten.co.jp/hgc/1b181ff9.a7b47385.1b181ffa.294cb7e7/?pc=https%3A%2F%2Fimg.travel.rakuten.co.jp%2Fimage%2Ftr%2Fapi%2Fhs%2FRmfmX%2F%3Ff_hotel_no%3D143278",
   "thumbnail": "https://img.travel.rakuten.co.jp/HIMG/90/143278.jpg",
   "imageUrl": "https://img.travel.rakuten.co.jp/share/HOTEL/143278/143278.jpg",
   "special": "マクロビ料理やファスティング。草津の上質な湯で生まれ変わる、心と体。木々のなかのウェルネスリゾート。"
  },
  {
   "hotelNo": 31451,
   "name": "草津温泉　湯の宿　みさご",
   "kana": "くさつおんせん　ゆのやど　みさご",
   "minCharge": 11700,
   "reviewAverage": 4.76,
   "reviewCount": 175,
   "access": "草津温泉バスターミナルより徒歩１０分 関越道渋川・伊香保ＩＣよりＲ３５３～１４５～２９２（約９０分）",
   "address1": "群馬県",
   "address2": "吾妻郡草津町546",
   "infoUrl": "https://hb.afl.rakuten.co.jp/hgc/1b181ff9.a7b47385.1b181ffa.294cb7e7/?pc=https%3A%2F%2Fimg.travel.rakuten.co.jp%2Fimage%2Ftr%2Fapi%2Fhs%2FdQ4dX%2F%3Ff_no%3D31451",
   "planUrl": "https://hb.afl.rakuten.co.jp/hgc/1b181ff9.a7b47385.1b181ffa.294cb7e7/?pc=https%3A%2F%2Fimg.travel.rakuten.co.jp%2Fimage%2Ftr%2Fapi%2Fhs%2FcHNRi%2F%3Ff_no%3D31451%26f_flg%3DPLAN",
   "reviewUrl": "https://hb.afl.rakuten.co.jp/hgc/1b181ff9.a7b47385.1b181ffa.294cb7e7/?pc=https%3A%2F%2Fimg.travel.rakuten.co.jp%2Fimage%2Ftr%2Fapi%2Fhs%2FRmfmX%2F%3Ff_hotel_no%3D31451",
   "thumbnail": "https://img.travel.rakuten.co.jp/HIMG/90/31451.jpg",
   "imageUrl": "https://img.travel.rakuten.co.jp/share/HOTEL/31451/31451.jpg",
   "special": "＼万代鉱のかけ流し温泉／24時間利用可能＊３つの貸切風呂はすべて無料です♪全室エアウィーヴ＆トイレ付"
  },
  {
   "hotelNo": 4904,
   "name": "草津温泉　望雲",
   "kana": "くさつおんせん　ぼううん",
   "minCharge": 18700,
   "reviewAverage": 4.68,
   "reviewCount": 1381,
   "access": "ＪＲ吾妻線長野原草津口駅から車で２０分。",
   "address1": "群馬県",
   "address2": "吾妻郡草津町433-1",
   "infoUrl": "https://hb.afl.rakuten.co.jp/hgc/1b181ff9.a7b47385.1b181ffa.294cb7e7/?pc=https%3A%2F%2Fimg.travel.rakuten.co.jp%2Fimage%2Ftr%2Fapi%2Fhs%2FdQ4dX%2F%3Ff_no%3D4904",
   "planUrl": "https://hb.afl.rakuten.co.jp/hgc/1b181ff9.a7b47385.1b181ffa.294cb7e7/?pc=https%3A%2F%2Fimg.travel.rakuten.co.jp%2Fimage%2Ftr%2Fapi%2Fhs%2FcHNRi%2F%3Ff_no%3D4904%26f_flg%3DPLAN",
   "reviewUrl": "https://hb.afl.rakuten.co.jp/hgc/1b181ff9.a7b47385.1b181ffa.294cb7e7/?pc=https%3A%2F%2Fimg.travel.rakuten.co.jp%2Fimage%2Ftr%2Fapi%2Fhs%2FRmfmX%2F%3Ff_hotel_no%3D4904",
   "thumbnail": "https://img.travel.rakuten.co.jp/HIMG/90/4904.jpg",
   "imageUrl": "https://img.travel.rakuten.co.jp/share/HOTEL/4904/4904.jpg",
   "special": "創業慶長4年。６つのお風呂と2つの源泉が楽しめる、数々の文人に愛された、落ち着いた佇まいの旅館。"
  },
  {
   "hotelNo": 111177,
   "name": "草津温泉　綿の湯　草津ホテル別館",
   "kana": "わたのゆ　くさつほてるべっかん",
   "minCharge": 15400,
   "reviewAverage": 4.64,
   "reviewCount": 259,
   "access": "草津バスターミナルから徒歩で８分　送迎サービスはありません",
   "address1": "群馬県",
   "address2": "吾妻郡草津町草津469-4",
   "infoUrl": "https://hb.afl.rakuten.co.jp/hgc/1b181ff9.a7b47385.1b181ffa.294cb7e7/?pc=https%3A%2F%2Fimg.travel.rakuten.co.jp%2Fimage%2Ftr%2Fapi%2Fhs%2FdQ4dX%2F%3Ff_no%3D111177",
   "planUrl": "https://hb.afl.rakuten.co.jp/hgc/1b181ff9.a7b47385.1b181ffa.294cb7e7/?pc=https%3A%2F%2Fimg.travel.rakuten.co.jp%2Fimage%2Ftr%2Fapi%2Fhs%2FcHNRi%2F%3Ff_no%3D111177%26f_flg%3DPLAN",
   "reviewUrl": "https://hb.afl.rakuten.co.jp/hgc/1b181ff9.a7b47385.1b181ffa.294cb7e7/?pc=https%3A%2F%2Fimg.travel.rakuten.co.jp%2Fimage%2Ftr%2Fapi%2Fhs%2FRmfmX%2F%3Ff_hotel_no%3D111177",
   "thumbnail": "https://img.travel.rakuten.co.jp/HIMG/90/111177.jpg",
   "imageUrl": "https://img.travel.rakuten.co.jp/share/HOTEL/111177/111177.jpg",
   "special": "四季の移り変わりを楽しめる客室はシンプルな造りで寛げます。良質素材の心を込めた料理もご堪能下さい。"
  },
  {
   "hotelNo": 179990,
   "name": "ラビスタ草津ヒルズ（共立リゾート）",
   "kana": "らびすた　くさつひるず",
   "minCharge": 24860,
   "reviewAverage": 4.59,
   "reviewCount": 1095,
   "access": "渋川伊香保ICより車約６０km／JR長野原草津口より路線バス／草津温泉バスターミナルよりシャトルバス有",
   "address1": "群馬県",
   "address2": "吾妻郡草津町草津226-15",
   "infoUrl": "https://hb.afl.rakuten.co.jp/hgc/1b181ff9.a7b47385.1b181ffa.294cb7e7/?pc=https%3A%2F%2Fimg.travel.rakuten.co.jp%2Fimage%2Ftr%2Fapi%2Fhs%2FdQ4dX%2F%3Ff_no%3D179990",
   "planUrl": "https://hb.afl.rakuten.co.jp/hgc/1b181ff9.a7b47385.1b181ffa.294cb7e7/?pc=https%3A%2F%2Fimg.travel.rakuten.co.jp%2Fimage%2Ftr%2Fapi%2Fhs%2FcHNRi%2F%3Ff_no%3D179990%26f_flg%3DPLAN",
   "reviewUrl": "https://hb.afl.rakuten.co.jp/hgc/1b181ff9.a7b47385.1b181ffa.294cb7e7/?pc=https%3A%2F%2Fimg.travel.rakuten.co.jp%2Fimage%2Ftr%2Fapi%2Fhs%2FRmfmX%2F%3Ff_hotel_no%3D179990",
   "thumbnail": "https://img.travel.rakuten.co.jp/HIMG/90/179990.jpg",
   "imageUrl": "https://img.travel.rakuten.co.jp/share/HOTEL/179990/179990.jpg",
   "special": "楽天トラベル口コミ「風呂」4.64(6/28時点)★唯一無二の≪最上階温泉眺望浴場≫から絶景を望む"
  },
  {
   "hotelNo": 9598,
   "name": "草津温泉　草津ナウリゾートホテル",
   "kana": "くさつおんせん　くさつなうりぞーとほてる",
   "minCharge": 20800,
   "reviewAverage": 4.44,
   "reviewCount": 3350,
   "access": "関越道　練馬ＩＣ～渋川伊香保ＩＣ又は信越道碓井・軽井沢ICから草津温泉／ＪＲ吾妻線　長野原草津口駅よりバスで２５分",
   "address1": "群馬県",
   "address2": "吾妻郡草津町草津白根750",
   "infoUrl": "https://hb.afl.rakuten.co.jp/hgc/1b181ff9.a7b47385.1b181ffa.294cb7e7/?pc=https%3A%2F%2Fimg.travel.rakuten.co.jp%2Fimage%2Ftr%2Fapi%2Fhs%2FdQ4dX%2F%3Ff_no%3D9598",
   "planUrl": "https://hb.afl.rakuten.co.jp/hgc/1b181ff9.a7b47385.1b181ffa.294cb7e7/?pc=https%3A%2F%2Fimg.travel.rakuten.co.jp%2Fimage%2Ftr%2Fapi%2Fhs%2FcHNRi%2F%3Ff_no%3D9598%26f_flg%3DPLAN",
   "reviewUrl": "https://hb.afl.rakuten.co.jp/hgc/1b181ff9.a7b47385.1b181ffa.294cb7e7/?pc=https%3A%2F%2Fimg.travel.rakuten.co.jp%2Fimage%2Ftr%2Fapi%2Fhs%2FRmfmX%2F%3Ff_hotel_no%3D9598",
   "thumbnail": "https://img.travel.rakuten.co.jp/HIMG/90/9598.jpg",
   "imageUrl": "https://img.travel.rakuten.co.jp/share/HOTEL/9598/9598.jpg",
   "special": "自然豊かな森に囲まれたリゾートホテル。草津の名湯と高原ならではのアクティビティが一度に満喫できる。"
  },
  {
   "hotelNo": 107756,
   "name": "湯宿　季の庭（共立リゾート）",
   "kana": "ゆやど　ときのにわ",
   "minCharge": 27665,
   "reviewAverage": 4.42,
   "reviewCount": 1822,
   "access": "ＪＲ吾妻線『長野原草津口駅』より路線バスにて『草津温泉バスターミナル』25分、そちらから専用シャトルバスで5分。",
   "address1": "群馬県",
   "address2": "吾妻郡草津町草津464-214",
   "infoUrl": "https://hb.afl.rakuten.co.jp/hgc/1b181ff9.a7b47385.1b181ffa.294cb7e7/?pc=https%3A%2F%2Fimg.travel.rakuten.co.jp%2Fimage%2Ftr%2Fapi%2Fhs%2FdQ4dX%2F%3Ff_no%3D107756",
   "planUrl": "https://hb.afl.rakuten.co.jp/hgc/1b181ff9.a7b47385.1b181ffa.294cb7e7/?pc=https%3A%2F%2Fimg.travel.rakuten.co.jp%2Fimage%2Ftr%2Fapi%2Fhs%2FcHNRi%2F%3Ff_no%3D107756%26f_flg%3DPLAN",
   "reviewUrl": "https://hb.afl.rakuten.co.jp/hgc/1b181ff9.a7b47385.1b181ffa.294cb7e7/?pc=https%3A%2F%2Fimg.travel.rakuten.co.jp%2Fimage%2Ftr%2Fapi%2Fhs%2FRmfmX%2F%3Ff_hotel_no%3D107756",
   "thumbnail": "https://img.travel.rakuten.co.jp/HIMG/90/107756.jpg",
   "imageUrl": "https://img.travel.rakuten.co.jp/share/HOTEL/107756/107756.jpg",
   "special": "全室温泉露天風呂付きの湯宿。温泉街から離れた高台に佇む湯宿で静かにお過ごしください。"
  },
  {
   "hotelNo": 108128,
   "name": "お宿　木の葉（共立リゾート）",
   "kana": "おやど　このは",
   "minCharge": 22880,
   "reviewAverage": 4.3,
   "reviewCount": 1249,
   "access": "ＪＲ吾妻線『長野原草津口駅』より路線バスにて『草津温泉バスターミナル』25分、そこから専用シャトルバスで5分。",
   "address1": "群馬県",
   "address2": "吾妻郡草津町草津白根464-214",
   "infoUrl": "https://hb.afl.rakuten.co.jp/hgc/1b181ff9.a7b47385.1b181ffa.294cb7e7/?pc=https%3A%2F%2Fimg.travel.rakuten.co.jp%2Fimage%2Ftr%2Fapi%2Fhs%2FdQ4dX%2F%3Ff_no%3D108128",
   "planUrl": "https://hb.afl.rakuten.co.jp/hgc/1b181ff9.a7b47385.1b181ffa.294cb7e7/?pc=https%3A%2F%2Fimg.travel.rakuten.co.jp%2Fimage%2Ftr%2Fapi%2Fhs%2FcHNRi%2F%3Ff_no%3D108128%26f_flg%3DPLAN",
   "reviewUrl": "https://hb.afl.rakuten.co.jp/hgc/1b181ff9.a7b47385.1b181ffa.294cb7e7/?pc=https%3A%2F%2Fimg.travel.rakuten.co.jp%2Fimage%2Ftr%2Fapi%2Fhs%2FRmfmX%2F%3Ff_hotel_no%3D108128",
   "thumbnail": "https://img.travel.rakuten.co.jp/HIMG/90/108128.jpg",
   "imageUrl": "https://img.travel.rakuten.co.jp/share/HOTEL/108128/108128.jpg",
   "special": "２つの大浴場と貸切露天風呂を合わせ２３種の湯めぐり三昧がお愉しみいただけます。"
  },
  {
   "hotelNo": 16110,
   "name": "亀の井ホテル　草津リゾート（旧：草津温泉ホテルリゾート）",
   "kana": "かめのいほてる　くさつりぞーと（きゅう：くさつおんせんほてるりぞーと）",
   "minCharge": 10815,
   "reviewAverage": 4.27,
   "reviewCount": 1343,
   "access": "ＪＲ吾妻線「長野原草津口駅」下車、JRバス「草津温泉行」約３０分、バスターミナル下車、無料送迎バスにてホテルへ",
   "address1": "群馬県",
   "address2": "吾妻郡草津町草津15-8",
   "infoUrl": "https://hb.afl.rakuten.co.jp/hgc/1b181ff9.a7b47385.1b181ffa.294cb7e7/?pc=https%3A%2F%2Fimg.travel.rakuten.co.jp%2Fimage%2Ftr%2Fapi%2Fhs%2FdQ4dX%2F%3Ff_no%3D16110",
   "planUrl": "https://hb.afl.rakuten.co.jp/hgc/1b181ff9.a7b47385.1b181ffa.294cb7e7/?pc=https%3A%2F%2Fimg.travel.rakuten.co.jp%2Fimage%2Ftr%2Fapi%2Fhs%2FcHNRi%2F%3Ff_no%3D16110%26f_flg%3DPLAN",
   "reviewUrl": "https://hb.afl.rakuten.co.jp/hgc/1b181ff9.a7b47385.1b181ffa.294cb7e7/?pc=https%3A%2F%2Fimg.travel.rakuten.co.jp%2Fimage%2Ftr%2Fapi%2Fhs%2FRmfmX%2F%3Ff_hotel_no%3D16110",
   "thumbnail": "https://img.travel.rakuten.co.jp/HIMG/90/16110.jpg",
   "imageUrl": "https://img.travel.rakuten.co.jp/share/HOTEL/16110/16110.jpg",